{
  "schema_version": 2,
  "client_submission_id": "abababab-abab-4bab-8bab-abababababab",
  "project_key": "mun-bon",
  "calendar_system": "rid-irrigation-v1",
  "week_key": "2026-R53",
  "week_date": "2026-10-31",
  "expected_active_submission_id": null,
  "levels": [
    {
      "area_type": "zone",
      "area_id": "01-06",
      "planning_depth_mm": 0.001
    }
  ]
}
